{
  "eventType": "AGENT_RUN_FINISHED",
  "schemaVersion": 1,
  "eventId": "8c0d1e2f-3a4b-4c5d-8e9f-0a1b2c3d4e5f",
  "traceId": "1c2d3e4f-0a1b-4c2d-8e3f-4a5b6c7d8e9f",
  "tripId": "9ee5e831-90f7-4a60-bb8d-fb488aa799ca",
  "runId": "5a1b2c3d-4e5f-4a6b-8c9d-0e1f2a3b4c5d",
  "occurredAt": "2026-08-29T08:31:00Z",
  "payload": {
    "status": "STOPPED",
    "reasonCode": "CEILING_REACHED",
    "message": "这次处理达到了单轮步骤上限，未能完成你的请求。可以换个说法再试一次。"
  }
}
